<?xml version="1.0" encoding="UTF-8"?>
<privacy-policy default-ruling="allow"
	xmlns="http://www.example.org/privacy"
	xmlns:xsi="http://www.w3.org/2001/XMLSchema-instance"
	xsi:schemaLocation="http://www.example.org/privacy ../src/privacy.xsd">
	<policy-information id="school-policy">
		<issuer>
			<name>luochen</name>
			<organization>Tsinghua</organization>
			<e-mail>luochen01@vip.qq.com</e-mail>
			<address>Tsinghua</address>
			<country>China</country>
		</issuer>
	</policy-information>
	
	<vocabulary-ref location="test/example-vocabulary.xml">
		<user-category-container refid="school-users"/>
		<data-category-container refid="school-data" />
	</vocabulary-ref>
	<rules>
		<allow id="allow-all">
			<user-category-ref refid="employee"/>
			<data-category-ref refid="pii" action="all"/>
		</allow>
		<deny id="deny-name-phone">
			<user-category-ref refid="employee"/>
			<data-category-ref refid="contact"/>
		</deny>
		<deny id="deny-disease">
			<user-category-ref refid="employee"/>
			<data-association>
				<data-category-ref refid="phone"/>
				<data-category-ref refid="disease"/>
			</data-association>
		</deny>
	</rules>
</privacy-policy>
