<?xml version="1.0" encoding="UTF-8"?>

<vocabulary base="test/base-vocabulary.xml"
	xmlns="http://www.example.org/privacy"
	xmlns:xsi="http://www.w3.org/2001/XMLSchema-instance"
	xsi:schemaLocation="http://www.example.org/privacy ../src/privacy.xsd">
	
	<vocabulary-information id="vocab-info">
		<issuer>
			<name>luochen</name>
			<organization>Tsinghua</organization>
			<e-mail>luochen01@vip.qq.com</e-mail>
			<address>Tsinghua</address>
			<country>China</country>
		</issuer>
	</vocabulary-information>
	
	<user-category-container id="school-users" base="default-users">
		<user-category id="student" parent="employee"/>
		<user-category id="teacher" parent="employee"/>
	</user-category-container>
	
	
	<data-category-container id="school-data">
		<data-category id="all"/>
		<data-category id="pii" parent="all"/>
		<data-category id="health" parent="all"/>
		<data-category id="financial" parent="all"/>
		<data-category id="name" parent="pii"/>
		<data-category id="ssn" parent="pii"/>
		<data-category id="contact" parent="pii"/>
		<data-category id="phone" parent="contact"/>
		<data-category id="email" parent="contact"/>
		<data-category id="disease" parent="health"/>
		<data-category id="health-test" parent="health"/>
		<data-category id="income" parent="financial"/>
		<data-category id="tax" parent="financial"/>
		<data-category id="salary" parent="tax"/>
	</data-category-container>
</vocabulary>
